{
  "schema": "witsoc.bridge-envelope.v1",
  "envelope_id": "envelope-example",
  "source": "frame:target-control",
  "destination": "example:source-map",
  "message_type": "witsoc.target.v1",
  "target_sha256": "0000000000000000000000000000000000000000000000000000000000000000",
  "correlation_id": "correlation-example",
  "causation_id": null,
  "content_sha256": "0000000000000000000000000000000000000000000000000000000000000000",
  "payload": {},
  "evidence_refs": [],
  "payload_sha256": "0000000000000000000000000000000000000000000000000000000000000000"
}
